title,type,question,A,B,C,D,E,F,G,answer,image
Male Reproduction System,radio,"Secretes nutritional fluid for the sperms /
Merembeskan bendalir yang mengandungi nutrien untuk sperma",Seminal vesicle / Vesikel semen,Urethra / Uretra,Sperm duct / Duktus Sperma,Penis / Zakar,Scrotum / Skrotum,Testis,Prostate glands / Kelenjar prostat,A,
,radio,"Discharge sperms and urine from the body / 
Mengeluarkan sperma dan air kencing keluar dari badan",Seminal vesicle / Vesikel semen,Urethra / Uretra,Sperm duct / Duktus Sperma,Penis / Zakar,Scrotum / Skrotum,Testis,Prostate glands / Kelenjar prostat,B,
,radio,"Transports sperms from the testis to the urethra inside the body / 
Menyalurkan sperma dari testis ke uretra di dalam badan",Seminal vesicle / Vesikel semen,Urethra / Uretra,Sperm duct / Duktus Sperma,Penis / Zakar,Scrotum / Skrotum,Testis,Prostate glands / Kelenjar prostat,C,
,radio,"Transfers sperms into the vagina / 
Memindahkan sperma ke dalam faraj",Seminal vesicle / Vesikel semen,Urethra / Uretra,Sperm duct / Duktus Sperma,Penis / Zakar,Scrotum / Skrotum,Testis,Prostate glands / Kelenjar prostat,D,
,radio,"Holds and protects the testes / 
Memegang dan melindungi testis",Seminal vesicle / Vesikel semen,Urethra / Uretra,Sperm duct / Duktus Sperma,Penis / Zakar,Scrotum / Skrotum,Testis,Prostate glands / Kelenjar prostat,E,
,radio,"Produces male gametes (sperms) and male sex hormones / 
Menghasilkan gamet jantan (sperma) dan hormon seks jantan",Seminal vesicle / Vesikel semen,Urethra / Uretra,Sperm duct / Duktus Sperma,Penis / Zakar,Scrotum / Skrotum,Testis,Prostate glands / Kelenjar prostat,F,
,radio,"Secrete fluid which contains nutrients and protects sperm cell / 
Menghasilkan cecair yang berkhasiat dan melindungi sel sperma",Seminal vesicle / Vesikel semen,Urethra / Uretra,Sperm duct / Duktus Sperma,Penis / Zakar,Scrotum / Skrotum,Testis,Prostate glands / Kelenjar prostat,G,
