title,type,question,A,B,C,D,E,F,answer,image
Exoskeleton,radio,大多数的生物生长曲线都是,Sigmoid-shaped / Berbentuk sigmoid,Stages / Berperingkat,,,,,A,
,radio,exoskeleton / rangka luar 生长曲线是,Sigmoid-shaped / Berbentuk sigmoid,Stages / Berperingkat,,,,,B,
,radio,为什么exoskeleton / rangka luar 要脱壳？,made up of hard chitin and it is unable to expand / terbina daripada kitin yang bersifat keras dan tidak boleh mengembang,It is too soft to protect the internal organs / Ia terlalu lembut untuk melindungi organ dalaman,It blocks sunlight from entering the body / Ia menghalang cahaya matahari daripada memasuki badan,,,,A,
,text,"The process of shedding the skin is called / 
Proses penanggalan kulit ini dinamakan",,,,,,,"ecdysis,ekdisis",
,radio,exoskeleton / rangka luar 小时候叫,nymph / nimfa,Larva,Tadpole / Berudu,,,,A,
