title,type,question,A,B,C,D,answer,image
The Functions of the Endoskeleton in Animals,radio,"strong pectoral girdle and pelvic girdle to support its body weight / 
lengkungan pektoral dan lengkungan pelvis yang kuat untuk menyokong berat badannya",Terrestrial Vertebrates / Haiwan Vertebrata Darat,Aquatic Vertebrates / Haiwan Vertebrata Akuatik,Birds / Burung,,A,
,radio,"pectoral girdle and the pelvic girdle are small and weak / 
lengkungan pektoral dan lengkungan pelvis adalah kecil dan lemah",Terrestrial Vertebrates / Haiwan Vertebrata Darat,Aquatic Vertebrates / Haiwan Vertebrata Akuatik,Birds / Burung,,B,
,radio,"The bones are also hollow and light / 
Tulang-tulang berongga dan ringan",Terrestrial Vertebrates / Haiwan Vertebrata Darat,Aquatic Vertebrates / Haiwan Vertebrata Akuatik,Birds / Burung,,C,
