type,question,A,B,C,D,E,F,G,H,answer,image
radio,Which planet is known as the Red Planet?,Earth,Mars,Jupiter,Venus,,,,,B,
checkbox,Which of the following are programming languages?,Python,HTML,JavaScript,CSS,C++,,,,"A,C,E",
text,What is the capital of Malaysia?,,,,,,,,,Kuala Lumpur,
radio,Select the largest ocean.,Atlantic,Indian,Pacific,Arctic,,,,,C,
checkbox,Select prime numbers.,2,3,4,5,6,7,,,"A,B,D,F",
radio,Which animal is shown in the image?,Cat,Dog,Elephant,Tiger,,,,,C,elephant.jpg
